{
  "schema_version": "1.0",
  "experiment_id": "EXP-2026-08-12-SCHEMA-EXAMPLE",
  "claim_ids": [
    "CLM-003"
  ],
  "status": "valid",
  "timestamps": {
    "started_at": "2026-08-12T14:00:00Z",
    "ended_at": "2026-08-12T14:15:00Z"
  },
  "people": {
    "operator": {
      "id": "example-operator",
      "role": "benchmark operator"
    },
    "reviewer": {
      "id": "example-reviewer",
      "role": "independent reviewer",
      "status": "approved"
    }
  },
  "source": {
    "repository": "https://example.invalid/forgellm",
    "baseline_commit": "1111111111111111111111111111111111111111",
    "candidate_commit": "2222222222222222222222222222222222222222",
    "baseline_clean": true,
    "candidate_clean": true
  },
  "hardware": {
    "path": "artifacts/examples/hardware.json",
    "sha256": "3333333333333333333333333333333333333333333333333333333333333333"
  },
  "software": {
    "manifest": {
      "path": "artifacts/examples/software.json",
      "sha256": "4444444444444444444444444444444444444444444444444444444444444444"
    },
    "command": "forgellm-bench --profile schema-example",
    "environment": {
      "FORGELLM_EXAMPLE": "1"
    }
  },
  "model": {
    "id": "synthetic/tiny-decoder",
    "revision": "example-revision-0001",
    "tokenizer_revision": "example-tokenizer-0001",
    "dtype": "fp32",
    "quantization": null,
    "weight_hash": "sha256:5555555555555555555555555555555555555555555555555555555555555555"
  },
  "workload": {
    "manifest": {
      "path": "artifacts/examples/workload.json",
      "sha256": "6666666666666666666666666666666666666666666666666666666666666666"
    },
    "prompt_tokens": {
      "distribution": "fixed",
      "values": [
        16
      ]
    },
    "output_tokens": {
      "distribution": "fixed",
      "values": [
        8
      ]
    },
    "concurrency": 1,
    "repetitions": 5,
    "warmup_repetitions": 2,
    "cache_state": "cold",
    "seeds": [
      7
    ]
  },
  "correctness": {
    "status": "pass",
    "oracle": "deterministic synthetic oracle",
    "metrics": {
      "max_abs_error": 0.0
    },
    "artifact": {
      "path": "artifacts/examples/correctness.json",
      "sha256": "7777777777777777777777777777777777777777777777777777777777777777"
    }
  },
  "measurements": [
    {
      "metric": "synthetic_tokens_per_second",
      "unit": "token/s",
      "direction": "higher_is_better",
      "baseline_samples": [
        100.0,
        101.0,
        99.0,
        100.5,
        99.5
      ],
      "candidate_samples": [
        110.0,
        109.0,
        111.0,
        110.5,
        109.5
      ],
      "baseline_summary": {
        "count": 5,
        "mean": 100.0,
        "median": 100.0,
        "stdev": 0.7905694150420949,
        "min": 99.0,
        "max": 101.0,
        "p95": 101.0
      },
      "candidate_summary": {
        "count": 5,
        "mean": 110.0,
        "median": 110.0,
        "stdev": 0.7905694150420949,
        "min": 109.0,
        "max": 111.0,
        "p95": 111.0
      }
    }
  ],
  "artifacts": [
    {
      "path": "artifacts/examples/raw-samples.json",
      "sha256": "8888888888888888888888888888888888888888888888888888888888888888",
      "kind": "raw_samples"
    }
  ],
  "conclusion": {
    "scope": "Schema-only synthetic example; it is not a ForgeLLM performance result.",
    "effect": "Candidate synthetic samples are higher in this fabricated validation fixture.",
    "limitations": [
      "All values are fabricated solely to exercise validation."
    ]
  },
  "provenance": {
    "generated_by": "ForgeLLM Phase 0 scaffold",
    "generated_at": "2026-08-12T14:16:00Z"
  }
}
